No.     Time        Source                Destination           Protocol Length Sequence number Acknowledgment number Info
      2 0.023172    128.119.245.12        192.168.1.102         TCP      62     0               1                     http > health-polling [SYN, ACK] Seq=0 Ack=1 Win=5840 Len=0 MSS=1460 SACK_PERM=1
      6 0.053937    128.119.245.12        192.168.1.102         TCP      60     1               566                   http > health-polling [ACK] Seq=1 Ack=566 Win=6780 Len=0
      9 0.077294    128.119.245.12        192.168.1.102         TCP      60     1               2026                  http > health-polling [ACK] Seq=1 Ack=2026 Win=8760 Len=0
     12 0.124085    128.119.245.12        192.168.1.102         TCP      60     1               3486                  http > health-polling [ACK] Seq=1 Ack=3486 Win=11680 Len=0
     14 0.169118    128.119.245.12        192.168.1.102         TCP      60     1               4946                  http > health-polling [ACK] Seq=1 Ack=4946 Win=14600 Len=0
     15 0.217299    128.119.245.12        192.168.1.102         TCP      60     1               6406                  http > health-polling [ACK] Seq=1 Ack=6406 Win=17520 Len=0
     16 0.267802    128.119.245.12        192.168.1.102         TCP      60     1               7866                  http > health-polling [ACK] Seq=1 Ack=7866 Win=20440 Len=0
     17 0.304807    128.119.245.12        192.168.1.102         TCP      60     1               9013                  http > health-polling [ACK] Seq=1 Ack=9013 Win=23360 Len=0
     24 0.356437    128.119.245.12        192.168.1.102         TCP      60     1               10473                 http > health-polling [ACK] Seq=1 Ack=10473 Win=26280 Len=0
     25 0.400164    128.119.245.12        192.168.1.102         TCP      60     1               11933                 http > health-polling [ACK] Seq=1 Ack=11933 Win=29200 Len=0
     26 0.448613    128.119.245.12        192.168.1.102         TCP      60     1               13393                 http > health-polling [ACK] Seq=1 Ack=13393 Win=32120 Len=0
     27 0.500029    128.119.245.12        192.168.1.102         TCP      60     1               14853                 http > health-polling [ACK] Seq=1 Ack=14853 Win=35040 Len=0
     28 0.545052    128.119.245.12        192.168.1.102         TCP      60     1               16313                 http > health-polling [ACK] Seq=1 Ack=16313 Win=37960 Len=0
     29 0.576417    128.119.245.12        192.168.1.102         TCP      60     1               17205                 http > health-polling [ACK] Seq=1 Ack=17205 Win=37960 Len=0
     36 0.626496    128.119.245.12        192.168.1.102         TCP      60     1               18665                 http > health-polling [ACK] Seq=1 Ack=18665 Win=40880 Len=0
     37 0.672796    128.119.245.12        192.168.1.102         TCP      60     1               20125                 http > health-polling [ACK] Seq=1 Ack=20125 Win=43800 Len=0
     38 0.730684    128.119.245.12        192.168.1.102         TCP      60     1               21585                 http > health-polling [ACK] Seq=1 Ack=21585 Win=46720 Len=0
     39 0.772990    128.119.245.12        192.168.1.102         TCP      60     1               23045                 http > health-polling [ACK] Seq=1 Ack=23045 Win=49640 Len=0
     40 0.820622    128.119.245.12        192.168.1.102         TCP      60     1               24505                 http > health-polling [ACK] Seq=1 Ack=24505 Win=52560 Len=0
     41 0.853186    128.119.245.12        192.168.1.102         TCP      60     1               25397                 http > health-polling [ACK] Seq=1 Ack=25397 Win=52560 Len=0
     48 0.899423    128.119.245.12        192.168.1.102         TCP      60     1               26857                 http > health-polling [ACK] Seq=1 Ack=26857 Win=55480 Len=0
     49 0.949545    128.119.245.12        192.168.1.102         TCP      60     1               28317                 http > health-polling [ACK] Seq=1 Ack=28317 Win=58400 Len=0
     50 0.994715    128.119.245.12        192.168.1.102         TCP      60     1               29777                 http > health-polling [ACK] Seq=1 Ack=29777 Win=61320 Len=0
     51 1.039820    128.119.245.12        192.168.1.102         TCP      60     1               31237                 http > health-polling [ACK] Seq=1 Ack=31237 Win=62780 Len=0
     52 1.117097    128.119.245.12        192.168.1.102         TCP      60     1               33589                 http > health-polling [ACK] Seq=1 Ack=33589 Win=62780 Len=0
     59 1.200421    128.119.245.12        192.168.1.102         TCP      60     1               35049                 http > health-polling [ACK] Seq=1 Ack=35049 Win=62780 Len=0
     60 1.265026    128.119.245.12        192.168.1.102         TCP      60     1               37969                 http > health-polling [ACK] Seq=1 Ack=37969 Win=62780 Len=0
     61 1.362074    128.119.245.12        192.168.1.102         TCP      60     1               40889                 http > health-polling [ACK] Seq=1 Ack=40889 Win=62780 Len=0
     62 1.389886    128.119.245.12        192.168.1.102         TCP      60     1               41781                 http > health-polling [ACK] Seq=1 Ack=41781 Win=62780 Len=0
     69 1.488313    128.119.245.12        192.168.1.102         TCP      60     1               44701                 http > health-polling [ACK] Seq=1 Ack=44701 Win=62780 Len=0
     70 1.584980    128.119.245.12        192.168.1.102         TCP      60     1               47621                 http > health-polling [ACK] Seq=1 Ack=47621 Win=62780 Len=0
     71 1.661513    128.119.245.12        192.168.1.102         TCP      60     1               49973                 http > health-polling [ACK] Seq=1 Ack=49973 Win=62780 Len=0
     78 1.758227    128.119.245.12        192.168.1.102         TCP      60     1               52893                 http > health-polling [ACK] Seq=1 Ack=52893 Win=62780 Len=0
     79 1.860063    128.119.245.12        192.168.1.102         TCP      60     1               55813                 http > health-polling [ACK] Seq=1 Ack=55813 Win=62780 Len=0
     80 1.930880    128.119.245.12        192.168.1.102         TCP      60     1               58165                 http > health-polling [ACK] Seq=1 Ack=58165 Win=62780 Len=0
     87 2.029069    128.119.245.12        192.168.1.102         TCP      60     1               61085                 http > health-polling [ACK] Seq=1 Ack=61085 Win=62780 Len=0
     88 2.126682    128.119.245.12        192.168.1.102         TCP      60     1               64005                 http > health-polling [ACK] Seq=1 Ack=64005 Win=62780 Len=0
     89 2.203195    128.119.245.12        192.168.1.102         TCP      60     1               66357                 http > health-polling [ACK] Seq=1 Ack=66357 Win=62780 Len=0
     96 2.311413    128.119.245.12        192.168.1.102         TCP      60     1               69277                 http > health-polling [ACK] Seq=1 Ack=69277 Win=62780 Len=0
     97 2.404228    128.119.245.12        192.168.1.102         TCP      60     1               72197                 http > health-polling [ACK] Seq=1 Ack=72197 Win=62780 Len=0
     98 2.476576    128.119.245.12        192.168.1.102         TCP      60     1               74549                 http > health-polling [ACK] Seq=1 Ack=74549 Win=62780 Len=0
    105 2.576633    128.119.245.12        192.168.1.102         TCP      60     1               77469                 http > health-polling [ACK] Seq=1 Ack=77469 Win=62780 Len=0
    106 2.672045    128.119.245.12        192.168.1.102         TCP      60     1               80389                 http > health-polling [ACK] Seq=1 Ack=80389 Win=62780 Len=0
    107 2.747257    128.119.245.12        192.168.1.102         TCP      60     1               82741                 http > health-polling [ACK] Seq=1 Ack=82741 Win=62780 Len=0
    114 2.847009    128.119.245.12        192.168.1.102         TCP      60     1               85661                 http > health-polling [ACK] Seq=1 Ack=85661 Win=62780 Len=0
    115 2.944420    128.119.245.12        192.168.1.102         TCP      60     1               88581                 http > health-polling [ACK] Seq=1 Ack=88581 Win=62780 Len=0
    116 3.020822    128.119.245.12        192.168.1.102         TCP      60     1               90933                 http > health-polling [ACK] Seq=1 Ack=90933 Win=62780 Len=0
    123 3.117302    128.119.245.12        192.168.1.102         TCP      60     1               93853                 http > health-polling [ACK] Seq=1 Ack=93853 Win=62780 Len=0
    124 3.216127    128.119.245.12        192.168.1.102         TCP      60     1               96773                 http > health-polling [ACK] Seq=1 Ack=96773 Win=62780 Len=0
    125 3.291672    128.119.245.12        192.168.1.102         TCP      60     1               99125                 http > health-polling [ACK] Seq=1 Ack=99125 Win=62780 Len=0
    132 3.388926    128.119.245.12        192.168.1.102         TCP      60     1               102045                http > health-polling [ACK] Seq=1 Ack=102045 Win=62780 Len=0
    133 3.485275    128.119.245.12        192.168.1.102         TCP      60     1               104965                http > health-polling [ACK] Seq=1 Ack=104965 Win=62780 Len=0
    134 3.562531    128.119.245.12        192.168.1.102         TCP      60     1               107317                http > health-polling [ACK] Seq=1 Ack=107317 Win=62780 Len=0
    141 3.660330    128.119.245.12        192.168.1.102         TCP      60     1               110237                http > health-polling [ACK] Seq=1 Ack=110237 Win=62780 Len=0
    142 3.768417    128.119.245.12        192.168.1.102         TCP      60     1               113157                http > health-polling [ACK] Seq=1 Ack=113157 Win=62780 Len=0
    143 3.840483    128.119.245.12        192.168.1.102         TCP      60     1               115509                http > health-polling [ACK] Seq=1 Ack=115509 Win=62780 Len=0
    150 3.936967    128.119.245.12        192.168.1.102         TCP      60     1               118429                http > health-polling [ACK] Seq=1 Ack=118429 Win=62780 Len=0
    151 4.031145    128.119.245.12        192.168.1.102         TCP      60     1               121349                http > health-polling [ACK] Seq=1 Ack=121349 Win=62780 Len=0
    152 4.107455    128.119.245.12        192.168.1.102         TCP      60     1               123701                http > health-polling [ACK] Seq=1 Ack=123701 Win=62780 Len=0
    159 4.205521    128.119.245.12        192.168.1.102         TCP      60     1               126621                http > health-polling [ACK] Seq=1 Ack=126621 Win=62780 Len=0
    160 4.300300    128.119.245.12        192.168.1.102         TCP      60     1               129541                http > health-polling [ACK] Seq=1 Ack=129541 Win=62780 Len=0
    161 4.379826    128.119.245.12        192.168.1.102         TCP      60     1               131893                http > health-polling [ACK] Seq=1 Ack=131893 Win=62780 Len=0
    168 4.476833    128.119.245.12        192.168.1.102         TCP      60     1               134813                http > health-polling [ACK] Seq=1 Ack=134813 Win=62780 Len=0
    169 4.575928    128.119.245.12        192.168.1.102         TCP      60     1               137733                http > health-polling [ACK] Seq=1 Ack=137733 Win=62780 Len=0
    170 4.648167    128.119.245.12        192.168.1.102         TCP      60     1               140085                http > health-polling [ACK] Seq=1 Ack=140085 Win=62780 Len=0
    177 4.747988    128.119.245.12        192.168.1.102         TCP      60     1               143005                http > health-polling [ACK] Seq=1 Ack=143005 Win=62780 Len=0
    178 4.844598    128.119.245.12        192.168.1.102         TCP      60     1               145925                http > health-polling [ACK] Seq=1 Ack=145925 Win=62780 Len=0
    179 4.920051    128.119.245.12        192.168.1.102         TCP      60     1               148277                http > health-polling [ACK] Seq=1 Ack=148277 Win=62780 Len=0
    186 5.019189    128.119.245.12        192.168.1.102         TCP      60     1               151197                http > health-polling [ACK] Seq=1 Ack=151197 Win=62780 Len=0
    190 5.125019    128.119.245.12        192.168.1.102         TCP      60     1               154117                http > health-polling [ACK] Seq=1 Ack=154117 Win=62780 Len=0
    191 5.197286    128.119.245.12        192.168.1.102         TCP      60     1               156469                http > health-polling [ACK] Seq=1 Ack=156469 Win=62780 Len=0
    198 5.297257    128.119.245.12        192.168.1.102         TCP      60     1               159389                http > health-polling [ACK] Seq=1 Ack=159389 Win=62780 Len=0
    200 5.389471    128.119.245.12        192.168.1.102         TCP      60     1               162309                http > health-polling [ACK] Seq=1 Ack=162309 Win=62780 Len=0
    201 5.447887    128.119.245.12        192.168.1.102         TCP      60     1               164041                http > health-polling [ACK] Seq=1 Ack=164041 Win=62780 Len=0
    202 5.455830    128.119.245.12        192.168.1.102         TCP      60     1               164091                http > health-polling [ACK] Seq=1 Ack=164091 Win=62780 Len=0
    203 5.461175    128.119.245.12        192.168.1.102         HTTP     784    1               164091                HTTP/1.1 200 OK  (text/html)
